{
  "$schema": "../../../schema/style.schema.json",
  "schemaVersion": 1,
  "id": "headings",
  "name": "Headings",
  "category": "style",
  "group": "typography",
  "summary": "Use semantic heading elements and GOV.UK heading classes to create a consistent, navigable content hierarchy.",
  "source": {
    "guidanceUrl": "https://design-system.service.gov.uk/styles/headings/",
    "implementationUrl": "https://github.com/alphagov/govuk-frontend/blob/v6.5.0/packages/govuk-frontend/src/govuk/core/_typography.scss",
    "govukFrontendVersion": "6.5.0",
    "reviewedAt": "2026-09-09"
  },
  "rules": [
    "Use h1 through h6 elements for document structure and apply govuk-heading-xl, -l, -m or -s for visual size.",
    "Ordinarily use one clear h1, then descend through heading levels without choosing elements for their appearance.",
    "For common question pages, pair h1 with govuk-heading-l, h2 with govuk-heading-m and lower headings with the next suitable size.",
    "Use heading captions to provide context above a heading without replacing the heading itself."
  ],
  "accessibility": [
    "A heading level must reflect nesting in the page outline even when its GOV.UK size class differs.",
    "Do not use bold paragraphs as visual headings because screen-reader heading navigation will miss them.",
    "Any deliberate visual and semantic hierarchy mismatch needs accessibility testing in its full context."
  ],
  "restrictions": [
    "Do not select a heading element solely to obtain its default browser size or margin.",
    "Avoid very long headings; simplify the content and keep the page purpose clear."
  ],
  "tokenRefs": [
    "govuk.typography.scale.48.mobile-font-size",
    "govuk.typography.scale.36.mobile-font-size",
    "govuk.typography.scale.24.mobile-font-size",
    "govuk.typography.scale.19.mobile-font-size",
    "govuk.typography.weight.bold"
  ],
  "examples": [
    {
      "name": "Semantic page hierarchy",
      "language": "html",
      "code": "<h1 class=\"govuk-heading-l\">Apply for a licence</h1>\n<h2 class=\"govuk-heading-m\">Before you start</h2>\n<h3 class=\"govuk-heading-s\">What you need</h3>"
    }
  ]
}
