{
  "$schema": "../../../schema/style.schema.json",
  "schemaVersion": 1,
  "id": "section-break",
  "name": "Section break",
  "category": "style",
  "group": "page-structure",
  "summary": "Use a GOV.UK section break on an hr element to create a thematic break with standard spacing and an optional visible rule.",
  "source": {
    "guidanceUrl": "https://design-system.service.gov.uk/styles/section-break/",
    "implementationUrl": "https://github.com/alphagov/govuk-frontend/blob/v6.5.0/packages/govuk-frontend/src/govuk/core/_section-break.scss",
    "govukFrontendVersion": "6.5.0",
    "reviewedAt": "2026-09-09"
  },
  "rules": [
    "Use an hr element with govuk-section-break when the content has a genuine thematic break.",
    "Select govuk-section-break--m, --l or --xl for the required standard margin.",
    "Add govuk-section-break--visible only when users need a visible separator; the default break is represented by spacing alone."
  ],
  "accessibility": [
    "Use the native hr semantic only for a thematic change, not as decoration.",
    "Do not rely on the separator line as the only cue that a new subject or task begins."
  ],
  "restrictions": [
    "Do not use empty div elements, repeated hyphens or CSS borders as substitutes for the documented section-break contract."
  ],
  "tokenRefs": [
    "govuk.color.border",
    "govuk.spacing.static.3",
    "govuk.spacing.static.6",
    "govuk.spacing.static.9"
  ],
  "examples": [
    {
      "name": "Large visible section break",
      "language": "html",
      "code": "<hr class=\"govuk-section-break govuk-section-break--l govuk-section-break--visible\">"
    }
  ]
}
