{
  "$schema": "../../../schema/style.schema.json",
  "schemaVersion": 1,
  "id": "paragraphs",
  "name": "Paragraphs",
  "category": "style",
  "group": "typography",
  "summary": "Use GOV.UK body classes for readable text, with lead and small variants only when their hierarchy has a clear purpose.",
  "source": {
    "guidanceUrl": "https://design-system.service.gov.uk/styles/paragraphs/",
    "implementationUrl": "https://github.com/alphagov/govuk-frontend/blob/v6.5.0/packages/govuk-frontend/src/govuk/core/_typography.scss",
    "govukFrontendVersion": "6.5.0",
    "reviewedAt": "2026-09-09"
  },
  "rules": [
    "Use govuk-body for the majority of paragraph text; its default desktop size is 19px.",
    "Use govuk-body-l once at most near the start of a page when an introductory summary helps users.",
    "Use govuk-body-s sparingly for genuinely secondary content, not to make crowded content fit.",
    "Keep paragraphs concise and group related sentences under descriptive headings."
  ],
  "accessibility": [
    "Use p elements for paragraphs so content retains structure without CSS.",
    "Do not convey importance only by size; use clear wording and semantic structure.",
    "Maintain readable line lengths and test body text at enlarged sizes."
  ],
  "restrictions": [
    "Do not use the lead class for multiple paragraphs on the same page.",
    "Do not make the majority of service content small body text."
  ],
  "tokenRefs": [
    "govuk.typography.scale.24.mobile-font-size",
    "govuk.typography.scale.19.mobile-font-size",
    "govuk.typography.scale.16.mobile-font-size",
    "govuk.color.text"
  ],
  "examples": [
    {
      "name": "Lead and standard body copy",
      "language": "html",
      "code": "<p class=\"govuk-body-l\">Use this service to renew your licence.</p>\n<p class=\"govuk-body\">You will need your current licence number.</p>"
    }
  ]
}
